{
  "artifactVersion": "1.0.0",
  "deploymentKind": "enterprise-root",
  "chainKey": "base-sepolia",
  "chainId": 84532,
  "deployedAt": "2026-07-14T04:16:00.000Z",
  "deployedBy": "0xba136c070266D72aebFCcf26427132eb100d8E59",
  "companyKey": "0x91fe65197178b7293eadb629fcda5414445fe4b107bcd8ebbfbd11b5df4f999c",
  "enterpriseRoot": "0x5B6AC0Ff1c9E28090BD371FE870C638DD856b675",
  "localEnterpriseId": 1,
  "contracts": [
    {
      "name": "SymmetryEnterpriseRoot",
      "address": "0x5B6AC0Ff1c9E28090BD371FE870C638DD856b675",
      "txHash": null
    }
  ],
  "ownership": {
    "protocolAdmin": "0x03F4C13ce4d0beb4BD4554fC7BBaF36cb1f66b79",
    "upgradeAdmin": "0x6e15FB78F611C90f58017F106669c10a6ae084F4",
    "enterpriseOwner": "0xFB689f3Ff9f27F6a7C3C5A68c95693cD8F48F6EF"
  },
  "services": [
    "votoid",
    "automation",
    "eudr"
  ],
  "status": "broadcasted",
  "notes": [
    "Enterprise root deployment normalized to the production artifact schema."
  ]
}
