{
  "artifactVersion": "1.0.0",
  "deploymentKind": "factory",
  "chainKey": "base-sepolia",
  "chainId": 84532,
  "deployedAt": "2026-07-14T04:15:00.000Z",
  "deployedBy": "0xba136c070266D72aebFCcf26427132eb100d8E59",
  "companyKey": null,
  "enterpriseRoot": null,
  "localEnterpriseId": null,
  "contracts": [
    {
      "name": "EnterpriseRootFactory",
      "address": "0xa190BF8c9f7C3bfF95779797fcf4f52F66d1A8e7",
      "txHash": null
    }
  ],
  "ownership": {
    "protocolAdmin": "0x03F4C13ce4d0beb4BD4554fC7BBaF36cb1f66b79",
    "upgradeAdmin": "0x6e15FB78F611C90f58017F106669c10a6ae084F4",
    "enterpriseOwner": "0xFB689f3Ff9f27F6a7C3C5A68c95693cD8F48F6EF"
  },
  "services": [],
  "status": "broadcasted",
  "notes": [
    "Factory deployed on Base Sepolia for enterprise-root provisioning."
  ]
}
